{
  "schema_version": "1.0.0",
  "id": "gpt-4o",
  "name": "GPT-4o",
  "provider": {
    "name": "OpenAI",
    "url": "https://openai.com",
    "country": "US"
  },
  "release_date": "2024-05-01",
  "status": "ga",
  "description": "OpenAI's flagship multimodal model combining text, image, and video understanding with strong general purpose capabilities.",

  "license": {
    "name": "proprietary",
    "commercial_use": true,
    "open_weights": false
  },

  "architecture": {
    "type": "dense",
    "family": "Transformer",
    "modalities": {
      "input": ["text", "image", "code"],
      "output": ["text", "code"]
    }
  },

  "benchmarks": [
    {
      "name": "SWE-bench Verified",
      "category": "coding",
      "score": 33.2,
      "score_unit": "percent"
    }
  ],

  "capabilities": {
    "tool_calling": true,
    "function_calling": true
  },

  "intended_use": {
    "primary_uses": ["conversational", "code_generation", "multimodal_understanding", "general_tasks"]
  },

  "limitations": ["hallucinations", "knowledge_cutoff"],

  "meta": {
    "created_at": "2026-02-07T12:00:00Z",
    "updated_at": "2026-02-07T12:00:00Z",
    "created_by": "research-agent"
  }
}
