{
  "schema_version": "1.0.0",
  "id": "devstral-small-2-24b",
  "name": "Devstral Small 2 (24B)",
  "provider": {
    "name": "Mistral AI",
    "url": "https://mistral.ai",
    "country": "FR"
  },
  "release_date": "2025-12-01",
  "status": "ga",
  "description": "24B dense coding model optimized for code agents, capable of running on consumer hardware with 256K context window.",

  "sources": {
    "blog_post": "https://mistral.ai/news/devstral-2-vibe-cli"
  },

  "license": {
    "spdx_id": "Apache-2.0",
    "commercial_use": true,
    "open_weights": true
  },

  "architecture": {
    "type": "dense",
    "family": "Transformer",
    "total_params": "24B",
    "context_length": 262144,
    "modalities": {
      "input": ["text", "code"],
      "output": ["text", "code"]
    }
  },

  "benchmarks": [
    {
      "name": "SWE-bench Verified",
      "category": "coding",
      "score": 68.0,
      "score_unit": "percent",
      "source_url": "https://mistral.ai/news/devstral-2-vibe-cli"
    }
  ],

  "capabilities": {
    "tool_calling": true,
    "code_execution": true
  },

  "intended_use": {
    "primary_uses": ["code_generation", "agentic_coding"]
  },

  "meta": {
    "created_at": "2026-02-07T20:00:00Z",
    "updated_at": "2026-02-07T20:00:00Z",
    "created_by": "research-agent"
  }
}
