{
  "schema_version": "1.0.0",
  "id": "claude-opus-4-6",
  "name": "Claude Opus 4.6",
  "provider": {
    "name": "Anthropic",
    "url": "https://www.anthropic.com",
    "country": "US"
  },
  "release_date": "2026-02-05",
  "status": "ga",
  "description": "Frontier large language model from Anthropic with advanced reasoning capabilities and tool use. Delivers state-of-the-art performance on software engineering tasks and complex multi-step reasoning.",

  "sources": {
    "blog_post": "https://www.anthropic.com/news/claude-opus-4-6",
    "api_docs": "https://docs.anthropic.com"
  },

  "license": {
    "name": "proprietary",
    "commercial_use": true,
    "open_weights": false
  },

  "architecture": {
    "type": "dense",
    "family": "Transformer",
    "modalities": {
      "input": ["text", "image", "code"],
      "output": ["text", "code"]
    }
  },

  "benchmarks": [
    {
      "name": "SWE-bench Verified",
      "category": "coding",
      "score": 80.8,
      "score_unit": "percent",
      "methodology": {
        "num_trials": 25,
        "thinking_budget": "200K",
        "notes": "Averaged over 25 trials with 200K thinking budget"
      },
      "source_url": "https://www.anthropic.com/news/claude-opus-4-6"
    },
    {
      "name": "GPQA Diamond",
      "category": "reasoning",
      "score": 91.3,
      "score_unit": "percent",
      "source_url": "https://www.vellum.ai/blog/claude-opus-4-6-benchmarks"
    },
    {
      "name": "ARC-AGI-2",
      "category": "reasoning",
      "score": 68.8,
      "score_unit": "percent",
      "source_url": "https://www.vellum.ai/blog/claude-opus-4-6-benchmarks"
    },
    {
      "name": "Humanity's Last Exam",
      "category": "reasoning",
      "score": 40.0,
      "score_unit": "percent",
      "methodology": {
        "notes": "without tools; 53.1% with tools"
      },
      "source_url": "https://www.anthropic.com/news/claude-opus-4-6"
    },
    {
      "name": "MMMU-Pro",
      "category": "multimodal",
      "score": 77.3,
      "score_unit": "percent",
      "source_url": "https://www.vellum.ai/blog/claude-opus-4-6-benchmarks"
    }
  ],

  "capabilities": {
    "tool_calling": true,
    "function_calling": true,
    "thinking_modes": ["standard", "thinking"]
  },

  "intended_use": {
    "primary_uses": ["agentic_coding", "complex_reasoning", "code_generation", "research"]
  },

  "limitations": ["hallucinations", "knowledge_cutoff"],

  "meta": {
    "created_at": "2026-02-07T12:00:00Z",
    "updated_at": "2026-02-07T18:00:00Z",
    "created_by": "research-agent"
  }
}
