{
  "schema_version": "1.0.0",
  "id": "gemini-3-pro",
  "name": "Gemini 3 Pro",
  "provider": {
    "name": "Google DeepMind",
    "url": "https://deepmind.google",
    "country": "US"
  },
  "release_date": "2026-01-01",
  "knowledge_cutoff": "2025-01-01",
  "status": "ga",
  "description": "Advanced multimodal model with strong reasoning and coding abilities, supporting text, audio, images, video, and code repositories.",

  "sources": {
    "blog_post": "https://blog.google/products-and-platforms/products/gemini/gemini-3/",
    "system_card": "https://storage.googleapis.com/deepmind-media/Model-Cards/Gemini-3-Pro-Model-Card.pdf"
  },

  "license": {
    "name": "Proprietary",
    "commercial_use": true,
    "open_weights": false
  },

  "architecture": {
    "type": "dense",
    "family": "Transformer",
    "modalities": {
      "input": ["text", "audio", "image", "video", "code"],
      "output": ["text", "code"]
    }
  },

  "training": {
    "compute": {
      "hardware": "Google TPUs",
      "methodology": "JAX, ML Pathways"
    }
  },

  "benchmarks": [
    {
      "name": "SWE-bench Verified",
      "category": "coding",
      "score": 76.2,
      "score_unit": "percent",
      "source_url": "https://blog.google/products-and-platforms/products/gemini/gemini-3/"
    },
    {
      "name": "MMMU-Pro",
      "category": "multimodal",
      "score": 81.0,
      "score_unit": "percent",
      "source_url": "https://blog.google/products-and-platforms/products/gemini/gemini-3/"
    },
    {
      "name": "MMMLU",
      "category": "knowledge",
      "score": 91.8,
      "score_unit": "percent",
      "source_url": "https://blog.google/products-and-platforms/products/gemini/gemini-3/"
    },
    {
      "name": "GPQA Diamond",
      "category": "reasoning",
      "score": 91.9,
      "score_unit": "percent",
      "source_url": "https://automatio.ai/models/gemini-3-pro"
    },
    {
      "name": "MMLU-Pro",
      "category": "knowledge",
      "score": 85.0,
      "score_unit": "percent",
      "source_url": "https://automatio.ai/models/gemini-3-pro"
    },
    {
      "name": "HumanEval",
      "category": "coding",
      "score": 93.0,
      "score_unit": "percent",
      "source_url": "https://automatio.ai/models/gemini-3-pro"
    },
    {
      "name": "ARC-AGI-2",
      "category": "reasoning",
      "score": 31.1,
      "score_unit": "percent",
      "methodology": {
        "notes": "45.1% with Deep Think mode"
      },
      "source_url": "https://llm-stats.com/models/gemini-3-pro-preview"
    },
    {
      "name": "Humanity's Last Exam",
      "category": "reasoning",
      "score": 45.8,
      "score_unit": "percent",
      "source_url": "https://automatio.ai/models/gemini-3-pro"
    },
    {
      "name": "SimpleQA",
      "category": "knowledge",
      "score": 72.1,
      "score_unit": "percent",
      "source_url": "https://llm-stats.com/models/gemini-3-pro-preview"
    },
    {
      "name": "IFEval",
      "category": "knowledge",
      "score": 85.0,
      "score_unit": "percent",
      "source_url": "https://automatio.ai/models/gemini-3-pro"
    },
    {
      "name": "AIME 2025",
      "category": "reasoning",
      "score": 100.0,
      "score_unit": "percent",
      "methodology": {
        "notes": "with code execution; 95.0% without tools"
      },
      "source_url": "https://automatio.ai/models/gemini-3-pro"
    },
    {
      "name": "FrontierMath",
      "category": "reasoning",
      "score": 38.0,
      "score_unit": "percent",
      "methodology": {
        "notes": "Tiers 1-3; 19% on Tier 4"
      },
      "source_url": "https://x.com/EpochAIResearch/status/1991945942174761050"
    },
    {
      "name": "MathVista",
      "category": "multimodal",
      "score": 79.0,
      "score_unit": "percent",
      "source_url": "https://automatio.ai/models/gemini-3-pro"
    }
  ],

  "capabilities": {
    "tool_calling": true,
    "function_calling": true
  },

  "intended_use": {
    "primary_uses": ["conversational", "code_generation", "multimodal_understanding", "reasoning"],
    "out_of_scope": []
  },

  "meta": {
    "created_at": "2026-02-07T12:00:00Z",
    "updated_at": "2026-02-07T18:00:00Z",
    "created_by": "research-agent"
  }
}
