{
  "schema_version": "1.0.0",
  "id": "gemini-2-0-flash",
  "name": "Gemini 2.0 Flash",
  "provider": {
    "name": "Google DeepMind",
    "url": "https://deepmind.google",
    "country": "US"
  },
  "release_date": "2024-12-01",
  "status": "ga",
  "description": "Efficient multimodal model with support for text, images, video, and audio processing.",

  "sources": {
    "blog_post": "https://deepmind.google/en/models/gemini/flash/"
  },

  "license": {
    "name": "Proprietary",
    "commercial_use": true,
    "open_weights": false
  },

  "architecture": {
    "type": "dense",
    "family": "Transformer",
    "modalities": {
      "input": ["text", "image", "video", "audio", "code"],
      "output": ["text", "code"]
    }
  },

  "benchmarks": [
    {
      "name": "SWE-bench Verified",
      "category": "coding",
      "score": 51.8,
      "score_unit": "percent",
      "methodology": {
        "notes": "With code execution tools"
      },
      "source_url": "https://deepmind.google/en/models/gemini/flash/"
    }
  ],

  "capabilities": {
    "tool_calling": true,
    "function_calling": true,
    "code_execution": true
  },

  "intended_use": {
    "primary_uses": ["conversational", "code_generation", "multimodal_understanding"],
    "out_of_scope": []
  },

  "meta": {
    "created_at": "2026-02-07T12:00:00Z",
    "updated_at": "2026-02-07T12:00:00Z",
    "created_by": "research-agent"
  }
}
