{
  "schema_version": "1.0.0",
  "id": "glm-4-7-flash",
  "name": "GLM-4.7-Flash",
  "provider": {
    "name": "Zhipu AI",
    "url": "https://z.ai",
    "country": "CN"
  },
  "release_date": "2026-01-19",
  "status": "ga",
  "description": "Lightweight mixture-of-experts variant with 30B total parameters and 3B active, optimized for efficient inference with extended context.",

  "sources": {
    "huggingface": "https://huggingface.co/zai-org/GLM-4.7-Flash"
  },

  "license": {
    "spdx_id": "MIT",
    "commercial_use": true,
    "open_weights": true
  },

  "architecture": {
    "type": "moe",
    "family": "GLM4_MoE",
    "total_params": "30B",
    "active_params": "3B",
    "context_length": 128000,
    "modalities": {
      "input": ["text", "code"],
      "output": ["text", "code"]
    }
  },

  "inference": {
    "frameworks": ["vLLM", "SGLang", "Transformers"]
  },

  "benchmarks": [
    {
      "name": "SWE-bench Verified",
      "category": "coding",
      "score": 59.2,
      "score_unit": "percent"
    }
  ],

  "capabilities": {
    "tool_calling": true,
    "function_calling": true,
    "code_execution": true
  },

  "intended_use": {
    "primary_uses": ["code_generation", "conversational"],
    "out_of_scope": []
  },

  "related_models": [
    { "id": "glm-4-7", "relationship": "variant" }
  ],

  "meta": {
    "created_at": "2026-02-07T12:00:00Z",
    "updated_at": "2026-02-07T12:00:00Z",
    "created_by": "research-agent"
  }
}
