{
  "schema_version": "1.0.0",
  "id": "claude-sonnet-4-5",
  "name": "Claude Sonnet 4.5",
  "provider": {
    "name": "Anthropic",
    "url": "https://www.anthropic.com",
    "country": "US"
  },
  "release_date": "2025-10-01",
  "status": "ga",
  "description": "High-performance language model balancing speed and capability. Excels at coding tasks and reasoning with extended context windows and optional thinking mode.",

  "sources": {
    "blog_post": "https://www.anthropic.com/news/claude-sonnet-4-5",
    "api_docs": "https://docs.anthropic.com"
  },

  "license": {
    "name": "proprietary",
    "commercial_use": true,
    "open_weights": false
  },

  "architecture": {
    "type": "dense",
    "family": "Transformer",
    "modalities": {
      "input": ["text", "image", "code"],
      "output": ["text", "code"]
    }
  },

  "benchmarks": [
    {
      "name": "SWE-bench Verified",
      "category": "coding",
      "score": 77.2,
      "score_unit": "percent",
      "methodology": {
        "thinking_budget": "200K",
        "notes": "Standard thinking mode with 200K thinking budget"
      },
      "source_url": "https://www.anthropic.com/news/claude-sonnet-4-5"
    },
    {
      "name": "SWE-bench Verified (1M context)",
      "category": "coding",
      "score": 78.2,
      "score_unit": "percent",
      "methodology": {
        "thinking_budget": "200K",
        "context_used": "1M tokens",
        "notes": "Performance with extended 1M token context window"
      },
      "source_url": "https://www.anthropic.com/news/claude-sonnet-4-5"
    }
  ],

  "capabilities": {
    "tool_calling": true,
    "function_calling": true,
    "thinking_modes": ["standard", "thinking"]
  },

  "intended_use": {
    "primary_uses": ["code_generation", "conversational", "software_engineering", "reasoning"]
  },

  "limitations": ["hallucinations", "knowledge_cutoff"],

  "meta": {
    "created_at": "2026-02-07T12:00:00Z",
    "updated_at": "2026-02-07T12:00:00Z",
    "created_by": "research-agent"
  }
}
