{
  "schema_version": "1.0.0",
  "id": "qwen3-coder-480b",
  "name": "Qwen3-Coder-480B-A35B-Instruct",
  "provider": {
    "name": "Alibaba (Qwen)",
    "url": "https://qwen.ai",
    "country": "CN"
  },
  "release_date": "2025-07-22",
  "status": "ga",
  "description": "Large-scale open-source mixture-of-experts coding model with 480B total parameters and 35B active, trained on 7.5T tokens with Code RL and Long-Horizon Agent RL.",

  "sources": {
    "huggingface": "https://huggingface.co/Qwen/Qwen3-Coder-480B-A35B-Instruct",
    "blog_post": "https://qwenlm.github.io/blog/qwen3-coder/",
    "github": "https://github.com/QwenLM/Qwen3-Coder"
  },

  "license": {
    "spdx_id": "Apache-2.0",
    "commercial_use": true,
    "open_weights": true
  },

  "architecture": {
    "type": "moe",
    "family": "Transformer",
    "total_params": "480B",
    "active_params": "35B",
    "context_length": 262144,
    "max_context_length": 1000000,
    "modalities": {
      "input": ["text", "code"],
      "output": ["text", "code"]
    }
  },

  "training": {
    "tokens": "7.5T",
    "data_composition": {
      "code": 70,
      "text": 30
    },
    "data_sources": ["code", "text"],
    "methodology": ["SFT", "Code RL", "Long-Horizon Agent RL"],
    "compute": {
      "hardware": "H100-80GB cluster",
      "notes": "Trained with 20K parallel environments"
    }
  },

  "inference": {
    "frameworks": ["vLLM", "SGLang", "Transformers"]
  },

  "benchmarks": [
    {
      "name": "SWE-bench Verified",
      "category": "coding",
      "score": 69.6,
      "score_unit": "percent",
      "methodology": {
        "scaffolding": "OpenHands",
        "context_used": "500 turns"
      }
    },
    {
      "name": "SWE-bench Verified (pass@1)",
      "category": "coding",
      "score": 67.0,
      "score_unit": "percent"
    }
  ],

  "capabilities": {
    "tool_calling": true,
    "function_calling": true,
    "code_execution": true
  },

  "intended_use": {
    "primary_uses": ["code_generation", "agentic_coding", "software_engineering", "long_context_coding"],
    "out_of_scope": []
  },

  "meta": {
    "created_at": "2026-02-07T12:00:00Z",
    "updated_at": "2026-02-07T12:00:00Z",
    "created_by": "research-agent"
  }
}
