{
  "schema_version": "1.0.0",
  "id": "mimo-7b-rl",
  "name": "MiMo-7B-RL",
  "provider": {
    "name": "Xiaomi",
    "url": "https://mimo.xiaomi.com",
    "country": "CN"
  },
  "release_date": "2025-05-15",
  "status": "ga",
  "description": "7B dense reasoning model trained with RL on SFT checkpoint. Matches OpenAI o1-mini on math and code reasoning despite being much smaller. Uses Multi-Token Prediction (MTP).",

  "sources": {
    "huggingface": "https://huggingface.co/XiaomiMiMo/MiMo-7B-RL",
    "technical_report": "https://arxiv.org/abs/2505.07608",
    "github": "https://github.com/XiaomiMiMo/MiMo"
  },

  "license": {
    "spdx_id": "Apache-2.0",
    "commercial_use": true,
    "open_weights": true
  },

  "architecture": {
    "type": "dense",
    "family": "Transformer",
    "total_params": "7B",
    "context_length": 131072,
    "modalities": {
      "input": ["text", "code"],
      "output": ["text", "code"]
    }
  },

  "training": {
    "tokens": "25T",
    "methodology": ["SFT", "RL"]
  },

  "benchmarks": [
    {
      "name": "AIME 2025",
      "category": "reasoning",
      "score": 68.0,
      "score_unit": "percent",
      "source_url": "https://arxiv.org/abs/2505.07608"
    },
    {
      "name": "LiveCodeBench",
      "category": "coding",
      "score": 57.8,
      "score_unit": "percent",
      "source_url": "https://arxiv.org/abs/2505.07608"
    }
  ],

  "capabilities": {
    "thinking_modes": ["thinking"]
  },

  "intended_use": {
    "primary_uses": ["reasoning", "code_generation"]
  },

  "related_models": [
    { "id": "mimo-v2-flash", "relationship": "predecessor" }
  ],

  "meta": {
    "created_at": "2026-02-08T12:00:00Z",
    "updated_at": "2026-02-08T12:00:00Z",
    "created_by": "research-agent"
  }
}
